{
  "schema_version": 1,
  "manifest_semantics": {
    "expected_suppressed.matches": "Expected Valgrind used_suppression context count; ranges or per-scenario exact values are enforced.",
    "expected_suppressed.bytes": "Expected suppressed bytes; null means Valgrind does not emit a byte count for that finding type.",
    "required_usage": "A required rule must be observed whenever this evidence set exercises at least one of its allowed scenarios. Rules whose real-product scenarios are not presently executable remain tracked but cannot be declared stale from an unrelated scenario.",
    "usage_profiles": "Optional exact, scenario-specific cross-rule tuples are enforced only where an exact lost-record partition is a valid behavioral oracle.",
    "usage_profiles.evidence_identity": "An exact-profile evidence identity names a locally reviewed, gitignored archive and its recorded checksums; it does not claim that a clean clone contains that archive.",
    "protocol_ceilings": "A protocol-derived ceiling binds variable Memcheck lost/reachable partitions to a fixed acknowledged lifecycle, pinned runtime/source identities, per-rule context/byte/block limits, cross-rule relations, and paired raw/suppressed evidence."
  },
  "environment": {
    "os": "Ubuntu 24.04 amd64",
    "valgrind": "3.22.0",
    "gtk": "4.14.5+ds-0ubuntu0.10",
    "glib": "2.80.0-6ubuntu3.8",
    "fontconfig": "2.15.0-1.1ubuntu2",
    "pango": "1.52.1+ds-1build1",
    "librsvg": "2.58.0+dfsg-1build1",
    "ibus": "1.5.29-2"
  },
  "project_suppression_file": {
    "path": "linux/tests/valgrind.supp",
    "sha256": "d383aa6330805e6870bca941fb64b97eea670a110955246ad9940a72084dbf6d",
    "rule_count": 9
  },
  "effective_inherited_sets": [
    {
      "id": "ghostty-main",
      "base": "ghostty",
      "path": "valgrind.supp",
      "sha256": "8b782389ff232acdfca2e7cda0f4ef0fafbf5e699e1e07a096d9184bbccfcb44",
      "rule_count": 233,
      "audit": "Pinned wholesale because this is Ghostty's own regression suppression set. Duplicate rule names prevent name-only identity; hash, rule count, runtime usage, and the pinned Ghostty revision are therefore all checked."
    },
    {
      "id": "ghostty-gtk-embed",
      "base": "ghostty",
      "path": "src/gtk_embed_spike.valgrind.supp",
      "sha256": "6f1113cacd4ebd9cd48430d4b125c0923e7e97b5463892119e8789a4e811996c",
      "rule_count": 6,
      "audit": "Embedding-specific inherited rules cover loader metadata, Fontconfig, and GTK GIO initialization. The exact file is pinned and every used rule is retained in each report."
    },
    {
      "id": "valgrind-builtins",
      "base": "builtin",
      "version": "valgrind-3.22.0",
      "audit": "Valgrind built-in suppressions remain enabled in both raw and suppression-enabled candidate runs; raw means no Ghostty or Zentty suppression files, not --default-suppressions=no."
    }
  ],
  "usage_profiles": [],
  "protocol_ceilings": [
    {
      "id": "IBUS-PREEDIT-ACKNOWLEDGED-EIGHT-CALL-CEILING",
      "scenario": "Debug/ibus-focus/x11",
      "runtime_identity": {
        "gtk": "4.14.5",
        "ibus": "1.5.29-2",
        "ibus_gtk4": "1.5.29-2",
        "libibus": "1.5.29-2"
      },
      "source_identity": {
        "repository": "https://github.com/ibus/ibus.git",
        "version": "1.5.29",
        "revision": "0ad8e77bd36545974ad8acd0a5283cf72bc7c8ad",
        "path": "client/gtk4/ibusimcontext.c",
        "sha256": "421dec0149829c84d7ce292e9134a31d39f3b5170e168b66ebf42da3546cd6fa"
      },
      "lifecycle": {
        "contract": "linux/tests/lib/ibus-focus-protocol",
        "contract_sha256": "5c940161c1086feff86f94038023b3eec9c829066148c8a00e8763e5e2955612",
        "wrapper": "linux/tests/controlled-ibus-x11",
        "wrapper_sha256": "24ffd8bb69c42c662447b3320fcbdb75387c71efb6ba84865d9dcdbc96f56db3",
        "reproducer": "linux/tests/ibus-focus-reproducer.c",
        "reproducer_sha256": "03c9449c7a0a33693e2a469480ee521df3ee72693ba3f8af10b362260499775b",
        "sync_mode_environment": "IBUS_ENABLE_SYNC_MODE",
        "sync_mode_value": "1",
        "focus_cycles": 4,
        "clear_calls_per_cycle": 2,
        "expected_clear_calls": 8
      },
      "evidence_identity": {
        "reviewed": true,
        "verification_scope": "identity-only-local-archive",
        "public_access": {
          "status": "NOT_IMPLEMENTED",
          "tracking": "GH-10",
          "locator": null,
          "reason": "The complete paired receipts are retained only in a gitignored local archive pending redaction, external attestation, and public artifact retention."
        },
        "archive_path": "build/linux/qualification-runs/2026-08-03-ibus-acknowledged-ceiling-paired-8",
        "total_runs": 8,
        "independent_executions": true,
        "executable": {
          "path": "ibus-focus-reproducer",
          "sha256": "c105beb6ee2e105c212496f3f822c968706002d59607d5100ec6bb476a7cead3"
        },
        "receipt_pairs": [
          {
            "run": 1,
            "raw_receipt": {"path": "run-1.raw.log", "sha256": "af2be05760a9e5f38a6446cf5538b36c0cefd0a800be169848fe1a5c4ab456ff"},
            "suppressed_receipt": {"path": "run-1.suppressed.log", "sha256": "34c554a090c2624269306d9ed4217732a3ea35ca6256178eafc079b5ac9bb323"},
            "report": {"path": "run-1.json", "sha256": "8b82fbd855847d42ce69818dd5098d1cd0b5ae15b5d01dd14276f2564f016629"}
          },
          {
            "run": 2,
            "raw_receipt": {"path": "run-2.raw.log", "sha256": "1e2385436fd39fca13690eac2ba68ba7e830429f34c8d7841c66d1c70001ae3a"},
            "suppressed_receipt": {"path": "run-2.suppressed.log", "sha256": "cf9edf5ac8347fcf369d415c8adace5abe56e3e428d46f51815ec9a58b793e41"},
            "report": {"path": "run-2.json", "sha256": "c35441c2febe72bbd6989dbb33108bef576b91fc0c0bfa8c4530dd7673ae904b"}
          },
          {
            "run": 3,
            "raw_receipt": {"path": "run-3.raw.log", "sha256": "523a359a8c435008ab033c27cfb75359ff5ea63de417c1485fe239f61bfe6568"},
            "suppressed_receipt": {"path": "run-3.suppressed.log", "sha256": "6b292b24d45f87a087d87cb8c681a7f0926800b3ae685aa1f8d588dc06d8c96e"},
            "report": {"path": "run-3.json", "sha256": "6769d7795109f56e1bb9bbb2ec65347384d2e9211feae9aa2e29257f096e9ad4"}
          },
          {
            "run": 4,
            "raw_receipt": {"path": "run-4.raw.log", "sha256": "6f44343d25fafe5405607490be46e0ecc93d567772777b703a9b75cc7b4c513a"},
            "suppressed_receipt": {"path": "run-4.suppressed.log", "sha256": "9b3bd1107ad8372c8a67f0794a31244ba141394b1217615796559e1b8c4c250e"},
            "report": {"path": "run-4.json", "sha256": "9f7755cbb913c214982dee3f2436427339b37936c45d771fc89eabaabf90b5cc"}
          },
          {
            "run": 5,
            "raw_receipt": {"path": "run-5.raw.log", "sha256": "ac7d37e4c25702968b87f1e9c33c619cb77730e308ff70a2fd8c1af02281548b"},
            "suppressed_receipt": {"path": "run-5.suppressed.log", "sha256": "bc954820b23eb776528b989054e7b7d623e8ce41920ddc7f0a08898706bf5073"},
            "report": {"path": "run-5.json", "sha256": "f88d0d5974103575866fe6875b0ec68baa752a765180a24cea7513fc3d4959de"}
          },
          {
            "run": 6,
            "raw_receipt": {"path": "run-6.raw.log", "sha256": "619f8e83092f1ae430b2e3e0e078ce27e7846eaf3052a333b47602808c94e934"},
            "suppressed_receipt": {"path": "run-6.suppressed.log", "sha256": "3395f83de528047a95b4d6677cce9034e5c7f632dabbd85feb1c41854d5bb6a1"},
            "report": {"path": "run-6.json", "sha256": "abba0e4295a0d586afad58836f8d9082e566cfe60e4d048fa30c1ab307ac2485"}
          },
          {
            "run": 7,
            "raw_receipt": {"path": "run-7.raw.log", "sha256": "c808441e4936fd13d67c6957d072c6b92cec0d65d9ac646b76db5c5a44420c71"},
            "suppressed_receipt": {"path": "run-7.suppressed.log", "sha256": "83a6896f40bae1d7314b00faf1c26201bbfee6801b5e2d637e30250807ff6cdd"},
            "report": {"path": "run-7.json", "sha256": "7f14145ddd04fee81e66db43f27989171b7b244861c1d52da58e5501ff7ce436"}
          },
          {
            "run": 8,
            "raw_receipt": {"path": "run-8.raw.log", "sha256": "cca4d5e32fe705b6a564c3b511a649695696b22a3780f6f739465ef940ad4515"},
            "suppressed_receipt": {"path": "run-8.suppressed.log", "sha256": "31f554d0c19b96359d85f4159cf4aa55063b7b280e29b5163a609f0a5abbb8c4"},
            "report": {"path": "run-8.json", "sha256": "ae138fff8c3a697f0eb4c8b21affffe01d6d9e2b8ae5889b95ae0137be43f0ec"}
          }
        ],
        "checksums_receipt": {
          "path": "SHA256SUMS",
          "sha256": "4a4ed6b88b5f3339730b74bac41d3964cc512b494348d78054a4fe8c86f2d28f"
        }
      },
      "rules": [
        {
          "rule_name": "GTK IBus focus preedit object",
          "matches": {"min": 4, "max": 4},
          "bytes": {"min": 290, "max": 1160},
          "blocks": {"min": 4, "max": 16}
        },
        {
          "rule_name": "GTK IBus focus preedit string",
          "matches": {"min": 2, "max": 2},
          "bytes": {"min": 2, "max": 8},
          "blocks": {"min": 2, "max": 8}
        }
      ],
      "relations": {
        "string_bytes_equal_blocks": true,
        "string_requires_object": true,
        "all_usage_requires_acknowledged_lifecycle": true
      }
    }
  ],
  "rules": [
    {
      "rule_name": "GTK SVG loader stripped librsvg undefined values",
      "tracking_id": "ZENTTY-VG-SVG-001",
      "affected": "Ubuntu librsvg 2.58.0, GTK 4.14.5 GdkPixbuf SVG icon loading, Wayland or X11/Xwayland",
      "finding_type": "Memcheck:Cond undefined-value contexts",
      "expected_suppressed": {"matches": {"min": 11, "max": 11}, "bytes": null},
      "allowed_scenarios": ["Debug/single/wayland", "Debug/interaction/wayland", "Debug/single/x11", "Debug/interaction/x11", "ReleaseSafe/interaction/wayland", "ReleaseSafe/interaction/x11"],